{
  "$schema": "http://json-schema.org/draft-07/schema#",
  "title": "HuLa SDK Pin",
  "description": "Release-branch pin that binds the HuLa frontend to a specific matrix-js-sdk artifact and (transitively) to a synapse-rust commit. Enforced by scripts/verify-sdk-pin.mjs.",
  "type": "object",
  "required": [
    "sdk_package_name",
    "sdk_version",
    "sdk_commit",
    "sdk_mode",
    "ledger_schema",
    "synapse_rust_commit",
    "pinned_at",
    "pinned_by"
  ],
  "properties": {
    "$schema": { "type": "string" },
    "comment": { "type": "string" },
    "sdk_package_name": { "const": "matrix-js-sdk" },
    "sdk_version": {
      "type": "string",
      "description": "SemVer from matrix-js-sdk/package.json at pin time. May be empty on dev branches."
    },
    "sdk_commit": {
      "type": "string",
      "pattern": "^([0-9a-f]{7,40}|)$",
      "description": "Git SHA of the matrix-js-sdk checkout."
    },
    "sdk_mode": { "enum": ["link", "tarball", "registry"] },
    "ledger_schema": {
      "enum": ["1", "2", "3", "4"],
      "description": "Matches LEDGER_SCHEMA_VERSION in matrix-js-sdk/scripts/contract-sync.mjs and SCHEMA_VERSION in synapse-rust/src/web/routes/ledger_export.rs."
    },
    "synapse_rust_commit": {
      "type": "string",
      "pattern": "^([0-9a-f]{7,40}|)$"
    },
    "tarball_sha256": {
      "type": "string",
      "pattern": "^(sha256-[A-Fa-f0-9]{64}|)$"
    },
    "sdk_lib_fingerprint": {
      "type": "string",
      "pattern": "^(sha256-[A-Fa-f0-9]{64}|)$",
      "description": "In-package `lib/` content fingerprint of the pinned artifact (N-05). Binds the *installed* package to the tarball content — a version string cannot, because the release line changes code without bumping the version. Computed by scripts/sdk-lib-fingerprint.mjs; verified against node_modules by scripts/verify-sdk-pin.mjs."
    },
    "pinned_at": {
      "type": "string",
      "description": "ISO-8601 UTC timestamp, empty on dev branches."
    },
    "pinned_by": { "type": "string" }
  },
  "additionalProperties": false
}
