{
  "$schema": "./sdk-pin.schema.json",
  "comment": "Release-branch SDK/backend pin. CI blocks merges to release/* unless every field here matches the actually installed artifacts. See docs/HULA_SDK_REINTEGRATION_OPTIMIZATION_PLAN_2026-05-03.md §16.1.3.",
  "sdk_package_name": "matrix-js-sdk",
  "sdk_version": "40.2.0-langkebo.5",
  "sdk_commit": "45feec0e695ce6b9151d724c8dbaa0fa6aea830e",
  "sdk_mode": "tarball",
  "ledger_schema": "4",
  "synapse_rust_commit": "91c6d66fe1b22d1074a33108e3ad62d3f865d113",
  "tarball_sha256": "sha256-001e650a3a773da55ac9244c3e962754c3e82c64acee398959bb822437b71cb8",
  "pinned_at": "2026-10-08T08:52:37.350Z",
  "pinned_by": "ljf"
}
